{
  "schema_version": 1,
  "id": "AFR-2026-001",
  "slug": "beyond-identity-emerging-authority-layer",
  "series": "Autonomous Trust Systems",
  "title": "Beyond Identity",
  "subtitle": "The Emerging Authority Layer for Autonomous AI Systems",
  "status": "published",
  "publication_date": "2026-08-20",
  "evidence_cutoff": "2026-08-19",
  "research_status": "Emerging",
  "confidence": "Moderate-High",
  "authors": [
    "Chris Ma"
  ],
  "version": "1.0",
  "abstract": {
    "text": "Enterprise identity systems are beginning to recognize AI agents as distinct principals. NIST has placed software and AI agent identity and authorization on an explicit research agenda; Microsoft Entra documents agent identities with separate subject and actor semantics; and Okta documents agent-to-agent token exchange with configured delegation links [R1] [R2] [R3] [R6]. These are material signals, but they do not by themselves establish a settled architecture for autonomous authority. An identity can show which agent is present. A permission can show what a credential nominally permits. Neither alone proves on whose behalf a particular action is being taken, for what task, under which delegation chain, within what context and time window, or whether the action remains justified after conditions change. Recent research on authenticated delegation and authorization propagation treats these questions as distinct system problems rather than ordinary service-account administration [R21] [R23]. This Frontier Research report synthesizes those signals into an ACE hypothesis: autonomous systems may require an AI Authority Layer that evaluates effective authority as a contextual relationship among identity, principal, delegation, intent, scope, context, time, policy, and risk. The proposal is a conceptual model, not a standard, a claim of invention, or a production roadmap. Its purpose is to define falsifiable questions, evidence requirements, and research boundaries that can be reviewed as protocols and deployments mature.",
    "reference_ids": [
      "R1",
      "R2",
      "R3",
      "R6",
      "R21",
      "R23"
    ]
  },
  "sections": [
    {
      "id": "research-boundary",
      "title": "1. Research Boundary: A Synthesis, Not a Claim of Invention",
      "classification": "observed-evidence",
      "blocks": [
        {
          "type": "paragraph",
          "text": "The phrase AI Authority Layer is used here as a systematic abstraction over signals that already exist in identity engineering, authorization protocols, vendor products, standards discussions, and academic research. OAuth has long distinguished a resource owner, client, authorization server, resource server, scopes, and delegated access. Token Exchange adds subject and actor relationships; Rich Authorization Requests adds structured authorization details; Zero Trust rejects trust based only on network location [R14] [R15] [R20]. Agent-specific work now extends these foundations to non-human principals that plan, call tools, and delegate tasks. The ACE contribution in this report is therefore organizational: separate six concepts that are often collapsed—Identity, Authentication, Permission, Delegation, Authority, and Evidence—and ask what must be true for an autonomous action to be justified at runtime.",
          "reference_ids": [
            "R14",
            "R15",
            "R20"
          ]
        },
        {
          "type": "paragraph",
          "text": "The evidence cutoff is 19 August 2026. Product documentation shows what vendors describe and expose, not what every customer configuration can prove. Internet-Drafts are works in progress; they may change, expire, or never become standards. The expired Agent Authorization Profile is retained only as a historical emerging signal, while active drafts are labeled as such [R9] [R10] [R11] [R12] [R13]. Preprints are evidence of research attention and proposed mechanisms, not evidence of broad deployment or operational effectiveness. Even the trajectory-assurance paper, which states acceptance to a forthcoming 2026 venue, remains bounded evidence for this report because the event had not occurred by the cutoff [R24]. This status discipline matters: convergence in vocabulary can indicate a forming problem without proving that one architecture will win.",
          "reference_ids": [
            "R9",
            "R10",
            "R11",
            "R12",
            "R13",
            "R24"
          ]
        },
        {
          "type": "paragraph",
          "text": "The report also avoids a category mistake between legal authority and technical authorization. Organizations may use contracts, corporate roles, fiduciary duties, agency law, or regulation to determine who bears responsibility. A runtime system cannot resolve those doctrines merely by issuing a token. It can, however, preserve facts that legal, risk, and operational teams need: who initiated a task, which agent acted, what was delegated, which constraints applied, what decision was made, and what occurred. Authenticated-delegation research explicitly connects technical chains of authority with accountability while acknowledging unresolved legal adaptation [R21]. The AI Authority Layer hypothesis is limited to this technical and evidentiary role.",
          "reference_ids": [
            "R21"
          ]
        }
      ]
    },
    {
      "id": "identity-foundation",
      "title": "2. Identity Is Becoming Necessary Infrastructure",
      "classification": "observed-evidence",
      "blocks": [
        {
          "type": "paragraph",
          "text": "The first observable transition is from treating agents as anonymous application behavior to representing them as manageable identities. Microsoft Entra describes an agent identity as a special service principal created from an agent identity blueprint. Its documentation distinguishes autonomous agent tokens from interactive cases in which the token subject is a user and the actor is the agent identity. It also associates agent identities with sponsors, blueprints, tenant-local identifiers, lifecycle operations, and policy application [R3] [R5]. These design choices make an agent visible to existing administrative systems. They answer questions such as which account requested a token, what kind of agent was deployed, who sponsors it, and which tenant can govern it.",
          "reference_ids": [
            "R3",
            "R5"
          ]
        },
        {
          "type": "paragraph",
          "text": "NIST's AI Agent Standards Initiative and the NCCoE concept paper reinforce the same direction at an institutional level. NIST identifies agent authentication, identity infrastructure, authorization, security, and evaluation as active areas, while the NCCoE project focuses on applying identity and authorization approaches to enterprise software and AI agents [R1] [R2]. The OpenID Foundation's 2025 whitepaper similarly frames agentic identity as a problem involving entities, delegation, interactions, and accountability rather than a simple login event [R8]. Together these sources support a bounded conclusion: distinct identity for agents is moving toward enterprise infrastructure. They do not establish that identity alone can govern an autonomous workflow. Instead, they provide the stable subject on which richer authority decisions may depend.",
          "reference_ids": [
            "R1",
            "R2",
            "R8"
          ]
        }
      ]
    },
    {
      "id": "identity-authority-gap",
      "title": "3. The Gap Between Being Identified and Being Authorized to Act",
      "classification": "emerging-problem",
      "blocks": [
        {
          "type": "paragraph",
          "text": "Authentication answers whether a presented identity can be verified. Permission describes a grant associated with an identity, role, token, capability, or policy relation. Authority is narrower and more situational: whether this agent may perform this action now, on behalf of this principal, for this purpose, with this resource, under this delegation history and current risk state. Microsoft documents delegated and application permissions for agent identities and blocks a set of high-privilege roles and Graph permissions [R4]. That is meaningful least-privilege engineering, but a static grant still cannot encode every fact that may determine whether a particular autonomous action is justified. A calendar-reading scope, for example, does not establish that a meeting change serves the user's current task, remains within an approved time window, or may be delegated to a second agent.",
          "reference_ids": [
            "R4"
          ]
        },
        {
          "type": "paragraph",
          "text": "The distinction becomes clearer when an agent has technically valid credentials but the action conflicts with the principal's bounded intent. A service may accept the token because the issuer, audience, signature, and scope are valid. Yet the requested transfer amount, destination, data classification, task phase, or downstream recipient may fall outside the intended mandate. Rich Authorization Requests provides a standardized container for fine-grained authorization details, and Resource Indicators can restrict the target resource [R15] [R17]. Those are relevant building blocks, not a complete semantic answer. RFC 9396 explicitly leaves the meaning and comparison of authorization details to API-specific implementations. The emerging gap is therefore not merely a missing token field. It is the absence of a generally accepted way to bind delegated intent, policy, context, and evidence across an autonomous execution.",
          "reference_ids": [
            "R15",
            "R17"
          ]
        },
        {
          "type": "paragraph",